{
  "candidate_predicates": [
    "supported by",
    "standing on",
    "lying on",
    "attached to",
    "hanging on",
    "part of"
  ],
  "crop_paths": [
    {
      "frame_id": "frame-000000.color.jpg",
      "object_bbox_xyxy": [
        0.0,
        150.0,
        224.0,
        224.0
      ],
      "path": "local_dataset/qwen_vl_crops/scan001/subgraph_a/obj_3_obj_7/pair_view_000.png",
      "role": "pair",
      "subject_bbox_xyxy": [
        12.0,
        18.0,
        124.0,
        160.0
      ],
      "view_id": "view_000"
    }
  ],
  "geometry_summary": null,
  "object_id": 7,
  "object_label": "floor",
  "predicate_family": "support_contact",
  "record_id": "scan001::subgraph_a::obj_3->obj_7::support_contact",
  "scan_id": "scan001",
  "schema_version": "h001_qwen_vl_input_v2",
  "split": "held_out",
  "subgraph_id": "subgraph_a",
  "subject_id": 3,
  "subject_label": "chair",
  "view_set_id": "scan001::subgraph_a::obj_3->obj_7::top3"
}
